{
	"schema": 1,
	"prober": { "id": "cf-prober-1", "location": "cloudflare" },
	"exceptions": [
		{
			"site_id": "2",
			"fingerprint": "3d2f1a9c8b7e6d5c4b3a29180f7e6d5c4b3a29180f7e6d5c4b3a29180f7e6d5c",
			"class": "Illuminate\\Database\\QueryException",
			"message": "SQLSTATE[HY000] [2002] Connection refused",
			"file": "app/Http/Controllers/OrderController.php",
			"line": 84,
			"first_seen": "2026-09-05T15:02:11Z",
			"last_seen": "2026-09-05T15:02:11Z",
			"count": 1,
			"is_new": true,
			"trace": null
		},
		{
			"site_id": "2",
			"fingerprint": "aa11bb22cc33dd44ee55ff6677889900aa11bb22cc33dd44ee55ff6677889900",
			"class": "RuntimeException",
			"message": "Payment gateway returned an unexpected response",
			"file": "app/Services/Billing/Gateway.php",
			"line": 213,
			"first_seen": "2026-09-05T09:14:02Z",
			"last_seen": "2026-09-05T15:41:55Z",
			"count": 37,
			"is_new": false,
			"trace": null
		}
	],
	"suppressed": [],
	"dropped": []
}
